{
  "$schema": "../schemas/campaign.schema.json",
  "id": "imperial",
  "name": "The Imperial Campaign",
  "start_year": -270,
  "factions": [
    {
      "id": "senate",
      "treasury": 10000,
      "capital": "latium",
      "settlements": [
        {
          "region": "latium",
          "population": 13500,
          "buildings": [
            "roman_gov_5",
            "roman_walls_4",
            "roman_brk_4",
            "field_farms_3",
            "roman_jupiter_3"
          ],
          "garrison": [
            {
              "template": "roman_triarii",
              "experience": 2
            },
            {
              "template": "roman_principes",
              "experience": 1
            },
            {
              "template": "roman_hastati"
            },
            {
              "template": "roman_town_watch"
            }
          ]
        }
      ],
      "characters": [
        {
          "id": "sen_appius_claudius",
          "name": "Appius Claudius",
          "age": 58,
          "role": "leader",
          "command": 3,
          "management": 6,
          "influence": 8,
          "traits": [
            "statesman",
            "orator"
          ],
          "location": "latium"
        },
        {
          "id": "sen_manius_valerius",
          "name": "Manius Valerius",
          "age": 46,
          "role": "family",
          "command": 5,
          "management": 5,
          "influence": 6,
          "traits": [
            "just"
          ],
          "location": "latium"
        },
        {
          "id": "sen_titus_aemilius",
          "name": "Titus Aemilius",
          "age": 39,
          "role": "family",
          "command": 4,
          "management": 6,
          "influence": 5,
          "traits": [
            "steady_governor"
          ],
          "location": "latium"
        },
        {
          "id": "sen_antonia",
          "name": "Antonia",
          "age": 51,
          "role": "spouse",
          "gender": "female",
          "location": "latium"
        },
        {
          "id": "sen_caecilia",
          "name": "Caecilia",
          "age": 3,
          "role": "child",
          "gender": "female",
          "father": "sen_appius_claudius",
          "location": "latium"
        },
        {
          "id": "sen_pomponia",
          "name": "Pomponia",
          "age": 13,
          "role": "child",
          "gender": "female",
          "father": "sen_appius_claudius",
          "location": "latium"
        },
        {
          "id": "sen_agrippa",
          "name": "Agrippa Hostilius",
          "age": 5,
          "role": "child",
          "gender": "male",
          "father": "sen_appius_claudius",
          "location": "latium"
        }
      ],
      "diplomacy": [
        {
          "faction": "julii",
          "stance": "alliance"
        },
        {
          "faction": "junii",
          "stance": "alliance"
        },
        {
          "faction": "cornelii",
          "stance": "alliance"
        }
      ]
    },
    {
      "id": "julii",
      "treasury": 5000,
      "capital": "etruria",
      "settlements": [
        {
          "region": "etruria",
          "population": 6500,
          "buildings": [
            "roman_gov_4",
            "roman_walls_3",
            "roman_brk_3",
            "field_farms_2",
            "iron_mine_1"
          ],
          "garrison": [
            {
              "template": "roman_hastati"
            },
            {
              "template": "roman_velites"
            },
            {
              "template": "roman_town_watch"
            }
          ]
        },
        {
          "region": "umbria",
          "population": 2400,
          "buildings": [
            "roman_gov_3",
            "roman_walls_2",
            "field_farms_2"
          ],
          "garrison": [
            {
              "template": "roman_hastati"
            },
            {
              "template": "roman_town_watch"
            }
          ]
        }
      ],
      "armies": [
        {
          "region": "umbria",
          "general": "julii_lucius",
          "units": [
            {
              "template": "roman_general_guard"
            },
            {
              "template": "roman_hastati"
            },
            {
              "template": "roman_hastati"
            },
            {
              "template": "roman_velites"
            },
            {
              "template": "roman_equites"
            }
          ]
        }
      ],
      "characters": [
        {
          "id": "julii_caeso",
          "name": "Caeso Julius",
          "age": 54,
          "role": "leader",
          "command": 6,
          "management": 5,
          "influence": 7,
          "traits": [
            "skilled_commander",
            "statesman"
          ],
          "location": "etruria"
        },
        {
          "id": "julii_lucius",
          "name": "Lucius Julius",
          "age": 31,
          "role": "heir",
          "father": "julii_caeso",
          "command": 7,
          "management": 3,
          "influence": 4,
          "traits": [
            "brave",
            "energetic"
          ],
          "location": "umbria"
        },
        {
          "id": "julii_gaius",
          "name": "Gaius Julius",
          "age": 24,
          "role": "family",
          "father": "julii_caeso",
          "command": 4,
          "management": 6,
          "influence": 3,
          "traits": [
            "educated"
          ],
          "location": "umbria"
        },
        {
          "id": "julii_spurius",
          "name": "Spurius Julius",
          "age": 47,
          "role": "family",
          "command": 5,
          "management": 4,
          "influence": 4,
          "traits": [
            "scarred_veteran"
          ],
          "location": "etruria"
        },
        {
          "id": "julii_caecilia",
          "name": "Caecilia",
          "age": 51,
          "role": "spouse",
          "gender": "female",
          "location": "etruria"
        },
        {
          "id": "julii_cornelia",
          "name": "Cornelia",
          "age": 6,
          "role": "child",
          "gender": "female",
          "father": "julii_caeso",
          "location": "etruria"
        },
        {
          "id": "julii_vibius",
          "name": "Vibius Papirius",
          "age": 7,
          "role": "child",
          "gender": "male",
          "father": "julii_caeso",
          "location": "etruria"
        },
        {
          "id": "julii_terentia",
          "name": "Terentia",
          "age": 27,
          "role": "spouse",
          "gender": "female",
          "location": "umbria"
        },
        {
          "id": "julii_lucretia",
          "name": "Lucretia",
          "age": 4,
          "role": "child",
          "gender": "female",
          "father": "julii_lucius",
          "location": "umbria"
        },
        {
          "id": "julii_marcus",
          "name": "Marcus Domitius",
          "age": 4,
          "role": "child",
          "gender": "male",
          "father": "julii_lucius",
          "location": "umbria"
        }
      ],
      "diplomacy": [
        {
          "faction": "senate",
          "stance": "alliance"
        },
        {
          "faction": "junii",
          "stance": "alliance"
        },
        {
          "faction": "cornelii",
          "stance": "alliance"
        }
      ]
    },
    {
      "id": "junii",
      "treasury": 4500,
      "capital": "apulia",
      "settlements": [
        {
          "region": "apulia",
          "population": 7000,
          "buildings": [
            "roman_gov_4",
            "roman_walls_3",
            "roman_brk_3",
            "civic_port_1",
            "field_farms_2"
          ],
          "garrison": [
            {
              "template": "roman_hastati"
            },
            {
              "template": "roman_velites"
            },
            {
              "template": "roman_town_watch"
            }
          ]
        },
        {
          "region": "bruttium",
          "population": 2200,
          "buildings": [
            "roman_gov_3",
            "roman_walls_2",
            "field_farms_1"
          ],
          "garrison": [
            {
              "template": "roman_town_watch"
            },
            {
              "template": "roman_velites"
            }
          ]
        }
      ],
      "armies": [
        {
          "region": "apulia",
          "general": "junii_titus",
          "units": [
            {
              "template": "roman_general_guard"
            },
            {
              "template": "roman_hastati"
            },
            {
              "template": "roman_hastati"
            },
            {
              "template": "roman_equites"
            }
          ]
        }
      ],
      "characters": [
        {
          "id": "junii_decimus",
          "name": "Decimus Junius",
          "age": 51,
          "role": "leader",
          "command": 5,
          "management": 6,
          "influence": 6,
          "traits": [
            "steady_governor"
          ],
          "location": "apulia"
        },
        {
          "id": "junii_titus",
          "name": "Titus Junius",
          "age": 28,
          "role": "heir",
          "father": "junii_decimus",
          "command": 6,
          "management": 3,
          "influence": 4,
          "traits": [
            "brave"
          ],
          "location": "apulia"
        },
        {
          "id": "junii_marcus",
          "name": "Marcus Junius",
          "age": 22,
          "role": "family",
          "father": "junii_decimus",
          "command": 3,
          "management": 5,
          "influence": 3,
          "traits": [
            "educated"
          ],
          "location": "bruttium"